{
  "schema_version": "1.0",
  "scenario_id": "contradictory-subagent-outputs",
  "task_summary": "Synthetic run where two subagents contradict each other and a debugger resolves the failure source.",
  "repo_state": {
    "path": "synthetic-repo",
    "branch": "main",
    "starting_status": "clean",
    "ending_status": "synthetic fixture",
    "commit": "0000000"
  },
  "started_at": "2026-05-17T19:45:00Z",
  "finished_at": "2026-05-17T20:05:00Z",
  "root": {
    "model": "gpt-5.5",
    "reasoning_effort": "medium"
  },
  "routing_entries": [
    {
      "packet_id": "packet-conflict-debug-001",
      "step": "Resolve contradictory failure-source claims before continuing.",
      "tier": "Tier 3",
      "agent_role": "debugger",
      "runtime_type": "custom",
      "intended_model": "gpt-5.5",
      "actual_model": "gpt-5.5",
      "reasoning_effort": "high",
      "fallback_notes": "No fallback used.",
      "why_model_is_sufficient": "The selected model matches the role risk and bounded task complexity.",
      "evidence": [
        "One subagent claimed an introduced regression; another claimed an environment issue.",
        "Debugger compared command evidence and isolated the failure source."
      ],
      "open_risks": [],
      "next_decision": "Continue only with the evidence-backed classification.",
      "final_review_gate": "Root checks ledger, packet lifecycle, and validation evidence."
    }
  ],
  "context_packets": [
    {
      "schema_version": "2.0",
      "packet_id": "packet-conflict-debug-001",
      "role": "debugger",
      "objective": "Resolve contradictory subagent outputs about the failing test source.",
      "scope": [
        "ledger:subagent-a",
        "ledger:subagent-b",
        "cmd:focused-test"
      ],
      "non_goals": [
        "Do not broaden beyond the packet scope."
      ],
      "evidence_handles": [
        "ledger:subagent-a",
        "ledger:subagent-b",
        "ledger:routing-entry"
      ],
      "allowed_actions_and_paths": [
        "tests/",
        "src/"
      ],
      "constraints": [
        "Investigate only the conflicting evidence slice."
      ],
      "done_condition": "Return done, blocked, stuck, out-of-scope, or a precise Context request.",
      "output_budget_words": 480,
      "context_request_rule": "Use Context request with reason, requested_handle, and decision_impact before asking for broader context.",
      "expected_return": [
        "Findings",
        "Evidence",
        "Stuck status"
      ]
    }
  ],
  "subagent_lifecycle": [
    {
      "packet_id": "packet-conflict-debug-001",
      "role": "debugger",
      "event": "started",
      "timestamp": "2026-05-17T19:49:00Z",
      "evidence": "Minimal packet accepted with clear done condition."
    },
    {
      "packet_id": "packet-conflict-debug-001",
      "role": "debugger",
      "event": "completed",
      "exit_status": "done",
      "timestamp": "2026-05-17T20:00:00Z",
      "evidence": "Debugger resolved contradiction with command and diff evidence."
    }
  ],
  "escalations": [
    {
      "from_role": "test_triage",
      "to_role": "debugger",
      "reason": "Subagent outputs contradicted each other on failure source.",
      "result": "Debugger resolved the conflict before implementation continued."
    }
  ],
  "validation": [
    {
      "command": "python3 -m pytest tests/test_failure_source.py",
      "result": "passed",
      "evidence": "Synthetic focused test supports debugger classification."
    }
  ],
  "final_review": {
    "status": "passed",
    "reviewer": "root",
    "evidence": [
      "Packet lifecycle had a terminal exit.",
      "Contradictory outputs were routed to debugger.",
      "Root accepted the evidence-backed classification."
    ],
    "blockers": []
  },
  "residual_risks": [],
  "usage_estimate": {
    "subagent_count": 1,
    "models_used": [
      "gpt-5.5"
    ],
    "notes": "Synthetic contradiction fixture."
  }
}
